{
  "affected_entities": {
    "item_ids": [
      "af0bbb47f125381ce9f3597dc70ef07b:1"
    ],
    "order_ids": [
      "af0bbb47f125381ce9f3597dc70ef07b"
    ],
    "payment_ids": [
      "af0bbb47f125381ce9f3597dc70ef07b:1"
    ],
    "seller_ids": [
      "8b321bb669392f5163d04c59e235e066"
    ]
  },
  "assessment": {
    "case_status": "action_required",
    "confidence": 0.95,
    "primary_issue": "late_delivery_logistics"
  },
  "case_id": "EC_050",
  "evidence_ids": [
    "policy:CARRIER_DELIVERED_AFTER_ESTIMATE",
    "item:af0bbb47f125381ce9f3597dc70ef07b:1",
    "order:af0bbb47f125381ce9f3597dc70ef07b",
    "payment:af0bbb47f125381ce9f3597dc70ef07b:1",
    "seller:8b321bb669392f5163d04c59e235e066"
  ],
  "financial_resolution": {
    "currency": "BRL",
    "freight_total_brl": 14.1,
    "item_total_brl": 9.5,
    "payment_total_brl": 23.6,
    "recommended_refund_brl": 14.1
  },
  "resolution_actions": [
    "refund_freight"
  ],
  "root_cause_analysis": {
    "ranked_causes": [
      {
        "cause_code": "CARRIER_DELIVERED_AFTER_ESTIMATE",
        "rank": 1
      }
    ],
    "responsible_parties": [
      {
        "party_id": "LOGISTICS_PROVIDER",
        "party_type": "logistics_provider"
      }
    ]
  }
}
