{
  "affected_entities": {
    "item_ids": [
      "a88edef387e2a7e457695664bf0ddfc0:1"
    ],
    "order_ids": [
      "a88edef387e2a7e457695664bf0ddfc0"
    ],
    "payment_ids": [
      "a88edef387e2a7e457695664bf0ddfc0:1"
    ],
    "seller_ids": [
      "9646c3513289980f17226a2fc4720dbd"
    ]
  },
  "assessment": {
    "case_status": "action_required",
    "confidence": 0.92,
    "primary_issue": "late_delivery_logistics"
  },
  "case_id": "EC_016",
  "evidence_ids": [
    "policy:CARRIER_DELIVERED_AFTER_ESTIMATE",
    "item:a88edef387e2a7e457695664bf0ddfc0:1",
    "order:a88edef387e2a7e457695664bf0ddfc0",
    "payment:a88edef387e2a7e457695664bf0ddfc0:1",
    "seller:9646c3513289980f17226a2fc4720dbd"
  ],
  "financial_resolution": {
    "currency": "BRL",
    "freight_total_brl": 14.52,
    "item_total_brl": 38.0,
    "payment_total_brl": 52.52,
    "recommended_refund_brl": 14.52
  },
  "resolution_actions": [
    "refund_freight"
  ],
  "root_cause_analysis": {
    "ranked_causes": [
      {
        "cause_code": "CARRIER_DELIVERED_AFTER_ESTIMATE",
        "rank": 1
      }
    ],
    "responsible_parties": [
      {
        "party_id": "LOGISTICS_PROVIDER",
        "party_type": "logistics_provider"
      }
    ]
  }
}
