{
  "affected_entities": {
    "item_ids": [
      "2208f3a59d7067fe62c900692f5fdcaf:1"
    ],
    "order_ids": [
      "2208f3a59d7067fe62c900692f5fdcaf"
    ],
    "payment_ids": [
      "2208f3a59d7067fe62c900692f5fdcaf:1",
      "2208f3a59d7067fe62c900692f5fdcaf:2"
    ],
    "seller_ids": [
      "fde0cc9ea29c8ccfc0a2c22256a58c71"
    ]
  },
  "assessment": {
    "case_status": "no_action",
    "confidence": 0.95,
    "primary_issue": "valid_split_payment"
  },
  "case_id": "EC_046",
  "evidence_ids": [
    "policy:MULTIPLE_PAYMENTS_RECONCILED",
    "item:2208f3a59d7067fe62c900692f5fdcaf:1",
    "order:2208f3a59d7067fe62c900692f5fdcaf",
    "payment:2208f3a59d7067fe62c900692f5fdcaf:1",
    "payment:2208f3a59d7067fe62c900692f5fdcaf:2",
    "seller:fde0cc9ea29c8ccfc0a2c22256a58c71"
  ],
  "financial_resolution": {
    "currency": "BRL",
    "freight_total_brl": 27.01,
    "item_total_brl": 99.0,
    "payment_total_brl": 126.01,
    "recommended_refund_brl": 0.0
  },
  "resolution_actions": [
    "explain_valid_split_payment"
  ],
  "root_cause_analysis": {
    "ranked_causes": [
      {
        "cause_code": "MULTIPLE_PAYMENTS_RECONCILED",
        "rank": 1
      }
    ],
    "responsible_parties": []
  }
}
