{
  "affected_entities": {
    "item_ids": [
      "fe51b7fac3bea42115fa1c3b8973cba7:1"
    ],
    "order_ids": [
      "fe51b7fac3bea42115fa1c3b8973cba7"
    ],
    "payment_ids": [
      "fe51b7fac3bea42115fa1c3b8973cba7:1",
      "fe51b7fac3bea42115fa1c3b8973cba7:2"
    ],
    "seller_ids": [
      "85d9eb9ddc5d00ca9336a2219c97bb13"
    ]
  },
  "assessment": {
    "case_status": "no_action",
    "confidence": 1.0,
    "primary_issue": "valid_split_payment"
  },
  "case_id": "EC_006",
  "evidence_ids": [
    "policy:MULTIPLE_PAYMENTS_RECONCILED",
    "item:fe51b7fac3bea42115fa1c3b8973cba7:1",
    "order:fe51b7fac3bea42115fa1c3b8973cba7",
    "payment:fe51b7fac3bea42115fa1c3b8973cba7:1",
    "payment:fe51b7fac3bea42115fa1c3b8973cba7:2",
    "seller:85d9eb9ddc5d00ca9336a2219c97bb13"
  ],
  "financial_resolution": {
    "currency": "BRL",
    "freight_total_brl": 12.48,
    "item_total_brl": 31.9,
    "payment_total_brl": 44.38,
    "recommended_refund_brl": 0.0
  },
  "resolution_actions": [
    "explain_valid_split_payment"
  ],
  "root_cause_analysis": {
    "ranked_causes": [
      {
        "cause_code": "MULTIPLE_PAYMENTS_RECONCILED",
        "rank": 1
      }
    ],
    "responsible_parties": []
  }
}
