{
  "affected_entities": {
    "item_ids": [
      "13d341318c77969f10d77e1382957542:1"
    ],
    "order_ids": [
      "13d341318c77969f10d77e1382957542"
    ],
    "payment_ids": [
      "13d341318c77969f10d77e1382957542:1"
    ],
    "seller_ids": [
      "2e1a7d075abe038c1b2743005fe42ff1"
    ]
  },
  "assessment": {
    "case_status": "action_required",
    "confidence": 1.0,
    "primary_issue": "canceled_order_paid"
  },
  "case_id": "EC_021",
  "evidence_ids": [
    "policy:ORDER_CANCELED_AFTER_PAYMENT",
    "item:13d341318c77969f10d77e1382957542:1",
    "order:13d341318c77969f10d77e1382957542",
    "payment:13d341318c77969f10d77e1382957542:1",
    "seller:2e1a7d075abe038c1b2743005fe42ff1"
  ],
  "financial_resolution": {
    "currency": "BRL",
    "freight_total_brl": 8.96,
    "item_total_brl": 29.9,
    "payment_total_brl": 38.86,
    "recommended_refund_brl": 38.86
  },
  "resolution_actions": [
    "issue_full_refund"
  ],
  "root_cause_analysis": {
    "ranked_causes": [
      {
        "cause_code": "ORDER_CANCELED_AFTER_PAYMENT",
        "rank": 1
      }
    ],
    "responsible_parties": [
      {
        "party_id": "OLIST_PLATFORM",
        "party_type": "platform"
      }
    ]
  }
}
