{
  "affected_entities": {
    "item_ids": [
      "dd6ee4d96f0f3cf1432c3b82818e0387:1"
    ],
    "order_ids": [
      "dd6ee4d96f0f3cf1432c3b82818e0387"
    ],
    "payment_ids": [
      "dd6ee4d96f0f3cf1432c3b82818e0387:1"
    ],
    "seller_ids": [
      "1dfe5347016252a7884b694d4f10f5c4"
    ]
  },
  "assessment": {
    "case_status": "action_required",
    "confidence": 0.95,
    "primary_issue": "late_delivery_logistics"
  },
  "case_id": "EC_017",
  "evidence_ids": [
    "policy:CARRIER_DELIVERED_AFTER_ESTIMATE",
    "item:dd6ee4d96f0f3cf1432c3b82818e0387:1",
    "order:dd6ee4d96f0f3cf1432c3b82818e0387",
    "payment:dd6ee4d96f0f3cf1432c3b82818e0387:1",
    "seller:1dfe5347016252a7884b694d4f10f5c4"
  ],
  "financial_resolution": {
    "currency": "BRL",
    "freight_total_brl": 12.76,
    "item_total_brl": 60.0,
    "payment_total_brl": 72.76,
    "recommended_refund_brl": 12.76
  },
  "resolution_actions": [
    "refund_freight"
  ],
  "root_cause_analysis": {
    "ranked_causes": [
      {
        "cause_code": "CARRIER_DELIVERED_AFTER_ESTIMATE",
        "rank": 1
      }
    ],
    "responsible_parties": [
      {
        "party_id": "LOGISTICS_PROVIDER",
        "party_type": "logistics_provider"
      }
    ]
  }
}
