{
  "affected_entities": {
    "item_ids": [],
    "order_ids": [
      "80f0181edc2f4a5bd3384a3c39a83cee"
    ],
    "payment_ids": [
      "80f0181edc2f4a5bd3384a3c39a83cee:1"
    ],
    "seller_ids": []
  },
  "assessment": {
    "case_status": "action_required",
    "confidence": 0.92,
    "primary_issue": "unavailable_order_paid"
  },
  "case_id": "EC_028",
  "evidence_ids": [
    "policy:ORDER_UNAVAILABLE_AFTER_PAYMENT",
    "order:80f0181edc2f4a5bd3384a3c39a83cee",
    "payment:80f0181edc2f4a5bd3384a3c39a83cee:1"
  ],
  "financial_resolution": {
    "currency": "BRL",
    "freight_total_brl": 0.0,
    "item_total_brl": 0.0,
    "payment_total_brl": 61.19,
    "recommended_refund_brl": 61.19
  },
  "resolution_actions": [
    "issue_full_refund"
  ],
  "root_cause_analysis": {
    "ranked_causes": [
      {
        "cause_code": "ORDER_UNAVAILABLE_AFTER_PAYMENT",
        "rank": 1
      }
    ],
    "responsible_parties": [
      {
        "party_id": "OLIST_PLATFORM",
        "party_type": "platform"
      }
    ]
  }
}
