{
  "affected_entities": {
    "item_ids": [
      "5fba7c57daf631028d2a584c52799e24:1"
    ],
    "order_ids": [
      "5fba7c57daf631028d2a584c52799e24"
    ],
    "payment_ids": [
      "5fba7c57daf631028d2a584c52799e24:1"
    ],
    "seller_ids": [
      "1f50f920176fa81dab994f9023523100"
    ]
  },
  "assessment": {
    "case_status": "no_action",
    "confidence": 1.0,
    "primary_issue": "unsupported_late_claim"
  },
  "case_id": "EC_023",
  "evidence_ids": [
    "policy:DELIVERY_WITHIN_ESTIMATE",
    "item:5fba7c57daf631028d2a584c52799e24:1",
    "order:5fba7c57daf631028d2a584c52799e24",
    "payment:5fba7c57daf631028d2a584c52799e24:1",
    "seller:1f50f920176fa81dab994f9023523100"
  ],
  "financial_resolution": {
    "currency": "BRL",
    "freight_total_brl": 13.44,
    "item_total_brl": 59.9,
    "payment_total_brl": 73.34,
    "recommended_refund_brl": 0.0
  },
  "resolution_actions": [
    "reject_late_refund"
  ],
  "root_cause_analysis": {
    "ranked_causes": [
      {
        "cause_code": "DELIVERY_WITHIN_ESTIMATE",
        "rank": 1
      }
    ],
    "responsible_parties": []
  }
}
