{
  "affected_entities": {
    "item_ids": [
      "96087ef44ca9abdbc4c372a3dd3c859f:1"
    ],
    "order_ids": [
      "96087ef44ca9abdbc4c372a3dd3c859f"
    ],
    "payment_ids": [
      "96087ef44ca9abdbc4c372a3dd3c859f:1",
      "96087ef44ca9abdbc4c372a3dd3c859f:2"
    ],
    "seller_ids": [
      "7813ea3ebd9411dc600b4dd01f7a97b9"
    ]
  },
  "assessment": {
    "case_status": "no_action",
    "confidence": 1.0,
    "primary_issue": "valid_split_payment"
  },
  "case_id": "EC_020",
  "evidence_ids": [
    "policy:MULTIPLE_PAYMENTS_RECONCILED",
    "item:96087ef44ca9abdbc4c372a3dd3c859f:1",
    "order:96087ef44ca9abdbc4c372a3dd3c859f",
    "payment:96087ef44ca9abdbc4c372a3dd3c859f:1",
    "payment:96087ef44ca9abdbc4c372a3dd3c859f:2",
    "seller:7813ea3ebd9411dc600b4dd01f7a97b9"
  ],
  "financial_resolution": {
    "currency": "BRL",
    "freight_total_brl": 9.08,
    "item_total_brl": 260.0,
    "payment_total_brl": 269.08,
    "recommended_refund_brl": 0.0
  },
  "resolution_actions": [
    "explain_valid_split_payment"
  ],
  "root_cause_analysis": {
    "ranked_causes": [
      {
        "cause_code": "MULTIPLE_PAYMENTS_RECONCILED",
        "rank": 1
      }
    ],
    "responsible_parties": []
  }
}
