{
  "affected_entities": {
    "item_ids": [],
    "order_ids": [
      "31f935babbc97f5990e0ffd128e19541"
    ],
    "payment_ids": [
      "31f935babbc97f5990e0ffd128e19541:1"
    ],
    "seller_ids": []
  },
  "assessment": {
    "case_status": "action_required",
    "confidence": 0.95,
    "primary_issue": "unavailable_order_paid"
  },
  "case_id": "EC_019",
  "evidence_ids": [
    "policy:ORDER_UNAVAILABLE_AFTER_PAYMENT",
    "order:31f935babbc97f5990e0ffd128e19541",
    "payment:31f935babbc97f5990e0ffd128e19541:1"
  ],
  "financial_resolution": {
    "currency": "BRL",
    "freight_total_brl": 0.0,
    "item_total_brl": 0.0,
    "payment_total_brl": 74.7,
    "recommended_refund_brl": 74.7
  },
  "resolution_actions": [
    "issue_full_refund"
  ],
  "root_cause_analysis": {
    "ranked_causes": [
      {
        "cause_code": "ORDER_UNAVAILABLE_AFTER_PAYMENT",
        "rank": 1
      }
    ],
    "responsible_parties": [
      {
        "party_id": "OLIST_PLATFORM",
        "party_type": "platform"
      }
    ]
  }
}
