{
  "affected_entities": {
    "item_ids": [
      "c504f1f5fd54cc8398d57dc0da49de01:1"
    ],
    "order_ids": [
      "c504f1f5fd54cc8398d57dc0da49de01"
    ],
    "payment_ids": [
      "c504f1f5fd54cc8398d57dc0da49de01:1"
    ],
    "seller_ids": [
      "cfb1a033743668a192316f3c6d1d2671"
    ]
  },
  "assessment": {
    "case_status": "action_required",
    "confidence": 0.95,
    "primary_issue": "canceled_order_paid"
  },
  "case_id": "EC_015",
  "evidence_ids": [
    "policy:ORDER_CANCELED_AFTER_PAYMENT",
    "item:c504f1f5fd54cc8398d57dc0da49de01:1",
    "order:c504f1f5fd54cc8398d57dc0da49de01",
    "payment:c504f1f5fd54cc8398d57dc0da49de01:1",
    "seller:cfb1a033743668a192316f3c6d1d2671"
  ],
  "financial_resolution": {
    "currency": "BRL",
    "freight_total_brl": 19.59,
    "item_total_brl": 49.9,
    "payment_total_brl": 69.49,
    "recommended_refund_brl": 69.49
  },
  "resolution_actions": [
    "issue_full_refund"
  ],
  "root_cause_analysis": {
    "ranked_causes": [
      {
        "cause_code": "ORDER_CANCELED_AFTER_PAYMENT",
        "rank": 1
      }
    ],
    "responsible_parties": [
      {
        "party_id": "OLIST_PLATFORM",
        "party_type": "platform"
      }
    ]
  }
}
