{
  "affected_entities": {
    "item_ids": [
      "2478ddd1d1395639b71cf0d498d8dbf6:1"
    ],
    "order_ids": [
      "2478ddd1d1395639b71cf0d498d8dbf6"
    ],
    "payment_ids": [
      "2478ddd1d1395639b71cf0d498d8dbf6:1"
    ],
    "seller_ids": [
      "4e17c65a516f69d023a2ae78b84f28d6"
    ]
  },
  "assessment": {
    "case_status": "no_action",
    "confidence": 1.0,
    "primary_issue": "unsupported_late_claim"
  },
  "case_id": "EC_035",
  "evidence_ids": [
    "policy:DELIVERY_WITHIN_ESTIMATE",
    "item:2478ddd1d1395639b71cf0d498d8dbf6:1",
    "order:2478ddd1d1395639b71cf0d498d8dbf6",
    "payment:2478ddd1d1395639b71cf0d498d8dbf6:1",
    "seller:4e17c65a516f69d023a2ae78b84f28d6"
  ],
  "financial_resolution": {
    "currency": "BRL",
    "freight_total_brl": 11.85,
    "item_total_brl": 30.0,
    "payment_total_brl": 41.85,
    "recommended_refund_brl": 0.0
  },
  "resolution_actions": [
    "reject_late_refund"
  ],
  "root_cause_analysis": {
    "ranked_causes": [
      {
        "cause_code": "DELIVERY_WITHIN_ESTIMATE",
        "rank": 1
      }
    ],
    "responsible_parties": []
  }
}
