{
  "affected_entities": {
    "item_ids": [
      "64a8b3b4c19751b51d211deb32fdc67b:1"
    ],
    "order_ids": [
      "64a8b3b4c19751b51d211deb32fdc67b"
    ],
    "payment_ids": [
      "64a8b3b4c19751b51d211deb32fdc67b:1"
    ],
    "seller_ids": [
      "fc5a0d7a310a7a41abf86a458585ff2b"
    ]
  },
  "assessment": {
    "case_status": "action_required",
    "confidence": 1.0,
    "primary_issue": "canceled_order_paid"
  },
  "case_id": "EC_041",
  "evidence_ids": [
    "policy:ORDER_CANCELED_AFTER_PAYMENT",
    "item:64a8b3b4c19751b51d211deb32fdc67b:1",
    "order:64a8b3b4c19751b51d211deb32fdc67b",
    "payment:64a8b3b4c19751b51d211deb32fdc67b:1",
    "seller:fc5a0d7a310a7a41abf86a458585ff2b"
  ],
  "financial_resolution": {
    "currency": "BRL",
    "freight_total_brl": 8.29,
    "item_total_brl": 44.9,
    "payment_total_brl": 53.19,
    "recommended_refund_brl": 53.19
  },
  "resolution_actions": [
    "issue_full_refund"
  ],
  "root_cause_analysis": {
    "ranked_causes": [
      {
        "cause_code": "ORDER_CANCELED_AFTER_PAYMENT",
        "rank": 1
      }
    ],
    "responsible_parties": [
      {
        "party_id": "OLIST_PLATFORM",
        "party_type": "platform"
      }
    ]
  }
}
